### ISSUE TITLE
UPF policy routing bypasses EXT_DN NAT; UE traffic leaves as 12.1.1.x (no internet)

### ISSUE THREAD

**Issue by dswewww** [NVlabs/sionna-rk#6]
### Summary
After commit `b24853e`, the UPF removes the main-table default route. As a result, packets from the UE subnet (`12.1.1.0/24`) are forced to the upstream gateway `192.168.72.129` via `eth1`, bypassing `EXT_DN (192.168.72.135)` where MASQUERADE is configured. On the host egress, when pinging `8.8.8.8` from the UE, we see `src=12.1.1.2 → 8.8.8.8`, so replies are dropped and the UE has no internet connectivity.

---

### Regression
- **Before `b24853e`:** UE traffic traversed EXT_DN and was NATed (`src=192.168.72.135` on egress).  
- **After `b24853e`:** The patch in `b200_arm64` removes the UPF default route:
```bash
  ip route del default
```

[See line in commit.](https://github.com/NVlabs/sionna-rk/commit/b24853e9d0e214bd80c06a552ee83810961ffcc8#diff-aa02a8cb4e25582c970c1cd8ad73cb0ee64e37723f484f66cead03d82598376aR162)

Combined with:
```bash
ip rule add from 12.1.1.0/24 table eth1_table
ip route add default via 192.168.72.129 dev eth1 table eth1_table
````

this forces UE traffic to bypass EXT_DN, so MASQUERADE never applies.

### Steps to Reproduce
1. Start the network following docs/quick_start.rst.

2. Attach UE and ping 8.8.8.8 from UE side.

3. On the host egress interface (eth0 on Jetson):
  
  ```bash
  sudo tcpdump -ni eth0 host 8.8.8.8
  ```

  **Actual**: packets are src=12.1.1.2, no replies.
```bash
test@test-jetson-agx:~$ sudo tcpdump -ni eth0 host 8.8.8.8
tcpdump: verbose output suppressed, use -v[v]... for full protocol decode
listening on eth0, link-type EN10MB (Ethernet), snapshot length 262144 bytes
14:43:30.867759 IP 12.1.1.2 > 8.8.8.8: ICMP echo request, id 42616, seq 1, length 64
14:43:31.932705 IP 12.1.1.2 > 8.8.8.8: ICMP echo request, id 42616, seq 2, length 64
```
  **Expected**: packets are src=[HOST IP], replies succeed.
  ```bash
  14:43:43.208567 IP 192.168.0.118 > 8.8.8.8: ICMP echo request, id 42631, seq 1, length 64
  14:43:43.221970 IP 8.8.8.8 > 192.168.0.118: ICMP echo reply, id 42631, seq 1, length 64
  14:43:44.212959 IP 192.168.0.118 > 8.8.8.8: ICMP echo request, id 42631, seq 2, length 64
  14:43:44.225818 IP 8.8.8.8 > 192.168.0.118: ICMP echo reply, id 42631, seq 2, length 64
  14:43:45.213317 IP 192.168.0.118 > 8.8.8.8: ICMP echo request, id 42631, seq 3, length 64
  14:43:45.226322 IP 8.8.8.8 > 192.168.0.118: ICMP echo reply, id 42631, seq 3, length 64
  ```

### Quick Fix

Inside UPF, point the policy table to EXT_DN instead of upstream:
```bash
docker exec -d oai-upf  ip route replace default via 192.168.72.135 dev eth1 table eth1_table
```

**Comment by SebastianCa** [comment]
Fixed with release v1.1.0.
